{
  "id": "grosseto-mercato-esperanto",
  "name": "Mercato Esperanto - Grosseto",
  "image": "sample_plan.png",
  "gcp": [
    {
      "px": [100, 100],
      "ll": [42.75976, 11.11172],
      "note": "Angolo nord-ovest"
    },
    {
      "px": [1700, 100],
      "ll": [42.75976, 11.11668],
      "note": "Angolo nord-est"
    },
    {
      "px": [1700, 1100],
      "ll": [42.75734, 11.11668],
      "note": "Angolo sud-est"
    },
    {
      "px": [100, 1100],
      "ll": [42.75734, 11.11172],
      "note": "Angolo sud-ovest"
    }
  ],
  "area_px": [
    [150, 150],
    [1650, 150],
    [1650, 1050],
    [1650, 1050],
    [150, 1050]
  ],
  "stalls_px": [
    {
      "id": 1,
      "poly": [
        [200, 200],
        [230, 200],
        [230, 280],
        [200, 280]
      ],
      "w": 3,
      "h": 8,
      "row": "A"
    },
    {
      "id": 2,
      "poly": [
        [240, 200],
        [270, 200],
        [270, 280],
        [240, 280]
      ],
      "w": 3,
      "h": 8,
      "row": "A"
    },
    {
      "id": 3,
      "poly": [
        [280, 200],
        [310, 200],
        [310, 280],
        [280, 280]
      ],
      "w": 3,
      "h": 8,
      "row": "A"
    }
  ]
}

