{
  "id": "demo-sample",
  "image": "samples/sample_plan.png",
  "gcp": [
    { "px": [0, 0],      "ll": [42.7637, 11.1109] },
    { "px": [1000, 0],   "ll": [42.7641, 11.1130] },
    { "px": [1000, 600], "ll": [42.7626, 11.1126] },
    { "px": [0, 600],    "ll": [42.7627, 11.1110] }
  ],
  "area_px": [[40,80],[960,80],[960,520],[40,520]],
  "stalls_px": [
    { "id": 1, "poly": [[80,120],[180,120],[180,220],[80,220]] },
    { "id": 2, "poly": [[260,120],[360,120],[360,220],[260,220]] },
    { "id": 3, "poly": [[440,120],[540,120],[540,220],[440,220]] }
  ]
}
